[
  {
    "id": "QuickAssetSaver",
    "title": "Quick Asset Saver",
    "description": "Streamline saving assets to your local asset libraries.",
    "externalLink": "https://extensions.blender.org/add-ons/quick-asset-saver/",
    "tags": [
      "Blender",
      "Asset Management",
      "Productivity",
      "System"
    ],
    "images": [
      "/images/addons/QAS/SplashLogo.png"
    ],
    "badge": "Created"
  },
  {
    "id": "resin2fdm",
    "title": "Resin2FDM Lite/Advanced",
    "description": "Convert resin pre-supported miniatures to better suit FDM printing in Blender 4.0+. Originally designed by Painted4Combat",
    "externalLink": "https://painted4combat.gumroad.com/l/Resin2FdmLite",
    "tags": [
      "Blender",
      "3D Printing",
      "Miniatures"
    ],
    "images": [
      "/images/addons/Resin2FDM/Resin2FDM.jpg",
      "/images/addons/Resin2FDM/Resin2FDMLite.webp"
    ],
    "badge": "Maintained"
  },
  {
    "id": "nfc-generator",
    "title": "3D Printed NFC Generator",
    "description": "Design 3D-printable housings for NFC chips with custom logos, icons, or built-in QR backup codes.",
    "externalLink": "https://extensions.blender.org/add-ons/nfc-card-keychain-generator/versions/",
    "tags": [
      "Blender",
      "3D Printing",
      "NFC"
    ],
    "images": [
      "/images/addons/NFC_Gen/NFCExamplesHDScaled.png",
      "/images/addons/NFC_Gen/NFC-GenPlain1080x1920.png"
    ],
    "badge": "Created"
  },
  {
    "id": "blender-3mf",
    "title": "Blender 3MF Import/Export Format",
    "description": "Import and export 3MF files in Blender 4.2+. Updated from Ghostkeeper's work after two years without updates.",
    "externalLink": "https://github.com/Clonephaze/Blender3mfFormat---4.2-compatible",
    "tags": [
      "Blender",
      "File Format",
      "3D Printing"
    ],
    "images": [
      "/images/addons/3mf/3mfImportExport.png"
    ],
    "badge": "Updated & Maintained"
  }
]